{
  "ack_layers": {
    "explicit_claimed": false,
    "note": "JSON-RPC success is transport; session_visible only when SessionCorrelated; explicit never from transport alone",
    "source_correlated": false,
    "strongest_proven": "transport"
  },
  "acp_negotiation": {
    "ACP-INIT-001": {
      "id": "ACP-INIT-001",
      "status": "PASS",
      "detail": "protocolVersion=1 post_level=0 load=true cancel=false auth=[cached_token grok.com]",
      "at": "2026-08-11T13:16:28Z",
      "session_correlated": false
    }
  },
  "advice_results": {
    "ADVICE-DEDUP-001": {
      "id": "ADVICE-DEDUP-001",
      "status": "INCONCLUSIVE",
      "detail": "second delivery accepted at transport; durable/business InterventionID suppression not proven in harness (#200)",
      "at": "2026-08-11T13:18:53Z",
      "session_correlated": false,
      "intervention_id": "issue167-live-advice-001"
    }
  },
  "auth_boundary": {
    "ACP-AUTH-001": {
      "id": "ACP-AUTH-001",
      "status": "PASS",
      "detail": "delegated auth methodId=cached_token headless=true no token field",
      "at": "2026-08-11T13:16:28Z",
      "session_correlated": false
    }
  },
  "capability_manifests": {
    "auth_methods": [
      "cached_token",
      "grok.com"
    ],
    "caps_digest": "load=true pause=false cancel=false resume=false tool=false diff=false",
    "post_handshake": {
      "auth_methods": [
        "cached_token",
        "grok.com"
      ],
      "cap_advice_delivery": true,
      "cap_cancel": false,
      "cap_diff_inspection": false,
      "cap_event_stream": true,
      "cap_intervention_ack": false,
      "cap_pause": false,
      "cap_resume": false,
      "cap_tool_inspection": false,
      "explicit_ack": false,
      "honesty_note": "derived from initialize via protocol.EvaluateAchievableLevel; Level 2 requires full Level1 mask plus CapDiffInspection+CapPause+CapCancel+CapResume; JSON-RPC success is transport ACK not explicit agent ACK; never read/write ~/.grok/auth.json; live #167 harness path exercised on cmd/groklive (does not claim disposition GO); no CapPause/L2 claimed from hooks alone",
      "load_session": true,
      "negotiated_level": 0,
      "profile": "reinframe.grok_build_acp.v1",
      "protocol_version": 1
    },
    "pre_handshake": {
      "cap_advice_delivery": false,
      "cap_cancel": false,
      "cap_diff_inspection": false,
      "cap_event_stream": false,
      "cap_intervention_ack": false,
      "cap_pause": false,
      "cap_resume": false,
      "cap_tool_inspection": false,
      "explicit_ack": false,
      "honesty_note": "pre-handshake: no achieved level or unproven caps; call ManifestFromNegotiated after initialize; JSON-RPC success is transport ACK not explicit agent ACK; never read/write ~/.grok/auth.json; live #167 harness path via cmd/groklive does not imply disposition GO",
      "load_session": false,
      "negotiated_level": -1,
      "profile": "reinframe.grok_build_acp.v1",
      "protocol_version": 1
    }
  },
  "challenge_results": {
    "CHALLENGE-001": {
      "id": "CHALLENGE-001",
      "status": "PASS",
      "detail": "challenge text transported with ChallengeID preserved; #131 remains authoritative; no self-authorization claimed",
      "at": "2026-08-11T13:18:55Z",
      "session_correlated": false
    }
  },
  "entry_gates": {
    "auth_json_read": false,
    "credential_print": false,
    "live_flag_required": true
  },
  "final_disposition": "NO_GO",
  "hook_failure_semantics": {
    "HOOK-FAIL-001": {
      "id": "HOOK-FAIL-001",
      "status": "PASS",
      "detail": "broken hook invoked and marker written (timeout); exit_err=\u003cnil\u003e stdout_bytes=53109 stderr=",
      "host_outcome": "host_fail_open",
      "at": "2026-08-11T13:14:04Z",
      "fail_open_invoked": true,
      "session_correlated": false
    },
    "HOOK-FAIL-002": {
      "id": "HOOK-FAIL-002",
      "status": "PASS",
      "detail": "broken hook invoked and marker written (crash_nonzero_non_deny); exit_err=\u003cnil\u003e stdout_bytes=53110 stderr=",
      "host_outcome": "host_fail_open",
      "at": "2026-08-11T13:14:58Z",
      "fail_open_invoked": true,
      "session_correlated": false
    },
    "HOOK-FAIL-003": {
      "id": "HOOK-FAIL-003",
      "status": "PASS",
      "detail": "broken hook invoked and marker written (malformed); exit_err=\u003cnil\u003e stdout_bytes=53000 stderr=",
      "host_outcome": "host_fail_open",
      "at": "2026-08-11T13:15:38Z",
      "fail_open_invoked": true,
      "session_correlated": false
    },
    "HOOK-FAIL-004": {
      "id": "HOOK-FAIL-004",
      "status": "PASS",
      "detail": "broken hook invoked and marker written (oversized); exit_err=\u003cnil\u003e stdout_bytes=52910 stderr=",
      "host_outcome": "host_fail_open",
      "at": "2026-08-11T13:16:27Z",
      "fail_open_invoked": true,
      "session_correlated": false
    }
  },
  "hook_results": {
    "HOOK-ALLOW-001": {
      "id": "HOOK-ALLOW-001",
      "status": "PASS",
      "detail": "exit_err=\u003cnil\u003e stdout_bytes=49679 stderr=",
      "tool_name": "run_terminal_command",
      "host_outcome": "allowed",
      "at": "2026-08-11T13:11:56Z",
      "session_correlated": false
    },
    "HOOK-DENY-001": {
      "id": "HOOK-DENY-001",
      "status": "PASS",
      "detail": "direct deny response/exit observed for tool=run_terminal_command; exit_err=\u003cnil\u003e stdout_bytes=49220 stderr=",
      "tool_name": "run_terminal_command",
      "host_outcome": "enforced_deny",
      "at": "2026-08-11T13:12:40Z",
      "deny_direct_proof": true,
      "session_correlated": false
    },
    "HOOK-MAP-001": {
      "id": "HOOK-MAP-001",
      "status": "PASS",
      "detail": "observed_tools=run_terminal_command",
      "at": "2026-08-11T13:12:40Z",
      "session_correlated": false
    },
    "HOOK-UNINSTALL-001": {
      "id": "HOOK-UNINSTALL-001",
      "status": "PASS",
      "detail": "reinframe-owned hooks removed",
      "at": "2026-08-11T13:16:27Z",
      "session_correlated": false
    }
  },
  "limitations": [
    "ACP-SESSION-001 INCONCLUSIVE",
    "TRUST-STALE-001 INCONCLUSIVE",
    "ADVICE-DEDUP-001 INCONCLUSIVE",
    "STATIC-PERM-001 NOT_RUN",
    "ACP-OPTIONAL-001 INCONCLUSIVE",
    "live_grok_executable.json missing",
    "invalid/missing live_grok_executable forbids GO/LIMITED_GO",
    "ACP-SESSION-001 INCONCLUSIVE",
    "TRUST-STALE-001 INCONCLUSIVE",
    "ADVICE-DEDUP-001 INCONCLUSIVE",
    "STATIC-PERM-001 NOT_RUN",
    "ACP-OPTIONAL-001 INCONCLUSIVE",
    "final_disposition mismatches evaluateDisposition want=LIMITED_GO got=NO_GO"
  ],
  "privacy_checks": {
    "auth_json_path_leak_suspected": false,
    "auth_json_path_seen_in_honesty_notes_only": true,
    "auth_json_read": false,
    "bytes_scanned": 55406,
    "complete": true,
    "failure_classes": [],
    "files_scanned": 12,
    "files_seen": 12,
    "files_skipped": 0,
    "method": "complete_or_fail_flat_scan",
    "raw_thoughts_stored": false,
    "secret_pattern_hits": 0,
    "token_fields_in_auth_envelope": false
  },
  "process_cleanup": {
    "ACP-CLEANUP-001": {
      "id": "ACP-CLEANUP-001",
      "status": "PASS",
      "detail": "Close completed; owned PID 98810 not alive",
      "at": "2026-08-11T13:18:57Z",
      "session_correlated": false
    }
  },
  "provenance": {
    "derived": true,
    "evidence_binding_note": "generated by cmd/groklive report; live_binary_commit requires complete live_identity.json (no generator fallback)",
    "generated_at": "2026-08-12T02:39:08Z",
    "goarch": "arm64",
    "goos": "darwin",
    "grok_version": "grok-1.0.0-3cd0d0cbcebe",
    "grok_version_full": "grok 1.0.0 (3cd0d0cbcebe)",
    "harness": "cmd/groklive",
    "issue": 167,
    "live_binary_commit": "66ca8ae5503b9e6103078f76594f71a91e0a4970",
    "live_binary_commit_src": "ldflags",
    "live_binary_dirty": false,
    "main_tip_note": "evidence produced against live host using shipped #165/#166 APIs; v2 gates (#199/#215); live_binary_commit vs report_generator_commit may differ when report is re-run",
    "reinframe_commit": "a0627bde788c8bdd07c260aede1ddff84023e825",
    "reinframe_commit_src": "ldflags",
    "reinframe_dirty": false,
    "report_generator_commit": "a0627bde788c8bdd07c260aede1ddff84023e825",
    "report_generator_commit_src": "ldflags",
    "report_generator_dirty": false,
    "schema_note": "v2 closed disposition matrix; historical v1 evidence is immutable under HISTORICAL_v1.md",
    "starting_main_sha": "66ca8ae5503b9e6103078f76594f71a91e0a4970"
  },
  "scenario_registry": [
    "TRUST-001",
    "TRUST-STALE-001",
    "TRUST-RESTORE-001",
    "HOOK-ALLOW-001",
    "HOOK-DENY-001",
    "HOOK-MAP-001",
    "HOOK-UNINSTALL-001",
    "HOOK-FAIL-001",
    "HOOK-FAIL-002",
    "HOOK-FAIL-003",
    "HOOK-FAIL-004",
    "ACP-INIT-001",
    "ACP-AUTH-001",
    "ACP-SESSION-001",
    "ACP-CLEANUP-001",
    "ADVICE-DEDUP-001",
    "CHALLENGE-001",
    "STATIC-PERM-001"
  ],
  "scenarios": {
    "ACP-AUTH-001": {
      "id": "ACP-AUTH-001",
      "status": "PASS",
      "detail": "delegated auth methodId=cached_token headless=true no token field",
      "at": "2026-08-11T13:16:28Z",
      "session_correlated": false
    },
    "ACP-CLEANUP-001": {
      "id": "ACP-CLEANUP-001",
      "status": "PASS",
      "detail": "Close completed; owned PID 98810 not alive",
      "at": "2026-08-11T13:18:57Z",
      "session_correlated": false
    },
    "ACP-INIT-001": {
      "id": "ACP-INIT-001",
      "status": "PASS",
      "detail": "protocolVersion=1 post_level=0 load=true cancel=false auth=[cached_token grok.com]",
      "at": "2026-08-11T13:16:28Z",
      "session_correlated": false
    },
    "ACP-OPTIONAL-001": {
      "id": "ACP-OPTIONAL-001",
      "status": "INCONCLUSIVE",
      "detail": "loadSession negotiated but failed: grok acp: session/load: Invalid params",
      "at": "2026-08-11T13:18:51Z",
      "session_correlated": false
    },
    "ACP-SESSION-001": {